{
  "$schema": "https://json-schema.org/draft/2020-12/schema",
  "$id": "https://arpg.dev/schemas/golden/skill_points_and_magic_bolt.v0.schema.json",
  "title": "Golden: skill points and magic bolt (v0)",
  "type": "object",
  "required": ["description", "progression", "attack_speed", "skill"],
  "additionalProperties": false,
  "properties": {
    "description": { "type": "string" },
    "progression": {
      "type": "object",
      "required": ["points_per_level", "skill_points", "level_cases"],
      "additionalProperties": false,
      "properties": {
        "points_per_level": { "type": "integer", "minimum": 1 },
        "skill_points": {
          "type": "object",
          "required": ["points_per_grant", "first_grant_level"],
          "additionalProperties": false,
          "properties": {
            "points_per_grant": { "type": "integer", "minimum": 1 },
            "grant_every_levels": { "type": "integer", "minimum": 1 },
            "first_grant_level": { "type": "integer", "minimum": 1 },
            "second_grant_level": { "type": "integer", "minimum": 1 },
            "grant_every_min_level": { "type": "integer", "minimum": 1 }
          }
        },
        "level_cases": {
          "type": "array",
          "minItems": 1,
          "items": {
            "type": "object",
            "required": ["level", "expected_unspent_stat_points", "expected_unspent_skill_points"],
            "additionalProperties": false,
            "properties": {
              "level": { "type": "integer", "minimum": 1 },
              "expected_unspent_stat_points": { "type": "integer", "minimum": 0 },
              "expected_unspent_skill_points": { "type": "integer", "minimum": 0 }
            }
          }
        }
      }
    },
    "attack_speed": {
      "type": "object",
      "required": ["base_attack_interval_ticks", "min_effective_attack_speed", "max_effective_attack_speed", "cases"],
      "additionalProperties": false,
      "properties": {
        "base_attack_interval_ticks": { "type": "integer", "minimum": 1 },
        "min_effective_attack_speed": { "type": "number", "exclusiveMinimum": 0 },
        "max_effective_attack_speed": { "type": "number", "exclusiveMinimum": 0 },
        "cases": {
          "type": "array",
          "minItems": 1,
          "items": {
            "type": "object",
            "required": ["name", "dex_attack_speed", "weapon_attack_speed", "item_attack_speed_percent", "expected_effective_attack_speed", "expected_attack_interval_ticks", "expected_magic_bolt_cooldown_ticks"],
            "additionalProperties": false,
            "properties": {
              "name": { "type": "string", "minLength": 1 },
              "dex_attack_speed": { "type": "number", "exclusiveMinimum": 0 },
              "weapon_attack_speed": { "type": "number", "exclusiveMinimum": 0 },
              "item_attack_speed_percent": { "type": "integer" },
              "expected_effective_attack_speed": { "type": "number", "exclusiveMinimum": 0 },
              "expected_attack_interval_ticks": { "type": "integer", "minimum": 1 },
              "expected_magic_bolt_cooldown_ticks": { "type": "integer", "minimum": 1 }
            }
          }
        }
      }
    },
    "skill": {
      "type": "object",
      "required": ["skill_id", "class", "tree", "kind", "max_rank", "requirements", "rank_requirement_cases", "rank_cases"],
      "additionalProperties": false,
      "properties": {
        "skill_id": { "type": "string", "minLength": 1 },
        "class": { "type": "string", "minLength": 1 },
        "tree": {
          "type": "object",
          "required": ["tier", "column"],
          "additionalProperties": false,
          "properties": {
            "tier": { "type": "integer", "minimum": 1 },
            "column": { "type": "integer", "minimum": 1 }
          }
        },
        "kind": { "type": "string", "minLength": 1 },
        "max_rank": { "type": "integer", "minimum": 1 },
        "requirements": {
          "type": "object",
          "required": ["level", "stats", "skills"],
          "additionalProperties": false,
          "properties": {
            "level": { "type": "integer", "minimum": 1 },
            "level_per_rank": { "type": "integer", "minimum": 0 },
            "stats": {
              "type": "object",
              "additionalProperties": false,
              "properties": {
                "str": { "type": "integer", "minimum": 1 },
                "dex": { "type": "integer", "minimum": 1 },
                "vit": { "type": "integer", "minimum": 1 },
                "magic": { "type": "integer", "minimum": 1 }
              }
            },
            "stats_per_rank": {
              "type": "object",
              "additionalProperties": false,
              "properties": {
                "str": { "type": "integer", "minimum": 0 },
                "dex": { "type": "integer", "minimum": 0 },
                "vit": { "type": "integer", "minimum": 0 },
                "magic": { "type": "integer", "minimum": 0 }
              }
            },
            "skills": {
              "type": "array",
              "items": {
                "type": "object",
                "required": ["skill_id", "rank"],
                "additionalProperties": false,
                "properties": {
                  "skill_id": { "type": "string", "minLength": 1 },
                  "rank": { "type": "integer", "minimum": 1 }
                }
              }
            }
          }
        },
        "rank_requirement_cases": {
          "type": "array",
          "minItems": 1,
          "items": {
            "type": "object",
            "required": ["rank", "level", "stats"],
            "additionalProperties": false,
            "properties": {
              "rank": { "type": "integer", "minimum": 1 },
              "level": { "type": "integer", "minimum": 1 },
              "stats": {
                "type": "object",
                "additionalProperties": false,
                "properties": {
                  "str": { "type": "integer", "minimum": 1 },
                  "dex": { "type": "integer", "minimum": 1 },
                  "vit": { "type": "integer", "minimum": 1 },
                  "magic": { "type": "integer", "minimum": 1 }
                }
              }
            }
          }
        },
        "rank_cases": {
          "type": "array",
          "minItems": 1,
          "items": {
            "type": "object",
            "required": ["rank", "mana_cost", "damage"],
            "additionalProperties": false,
            "properties": {
              "rank": { "type": "integer", "minimum": 1 },
              "mana_cost": { "type": "integer", "minimum": 0 },
              "damage": {
                "type": "object",
                "required": ["min_percent", "max_percent"],
                "additionalProperties": false,
                "properties": {
                  "min_percent": { "type": "integer", "minimum": 1 },
                  "max_percent": { "type": "integer", "minimum": 1 }
                }
              }
            }
          }
        }
      }
    }
  }
}
