{
  "description": "Pinned v44 stat/skill point cadence, attack-speed cooldown foundation, and Magic Bolt rank scaling.",
  "progression": {
    "points_per_level": 3,
    "skill_points": {
      "points_per_grant": 1,
      "first_grant_level": 1,
      "second_grant_level": 2,
      "grant_every_levels": 2,
      "grant_every_min_level": 4
    },
    "level_cases": [
      {
        "level": 1,
        "expected_unspent_stat_points": 0,
        "expected_unspent_skill_points": 1
      },
      {
        "level": 2,
        "expected_unspent_stat_points": 3,
        "expected_unspent_skill_points": 2
      },
      {
        "level": 3,
        "expected_unspent_stat_points": 6,
        "expected_unspent_skill_points": 2
      },
      {
        "level": 6,
        "expected_unspent_stat_points": 15,
        "expected_unspent_skill_points": 4
      }
    ]
  },
  "attack_speed": {
    "base_attack_interval_ticks": 12,
    "min_effective_attack_speed": 0.25,
    "max_effective_attack_speed": 3,
    "cases": [
      {
        "name": "baseline_rusty_sword",
        "dex_attack_speed": 1.28125,
        "weapon_attack_speed": 1,
        "item_attack_speed_percent": 0,
        "expected_effective_attack_speed": 1.28125,
        "expected_attack_interval_ticks": 10,
        "expected_magic_bolt_cooldown_ticks": 20
      },
      {
        "name": "greatsword_slow",
        "dex_attack_speed": 1.28125,
        "weapon_attack_speed": 0.7,
        "item_attack_speed_percent": 0,
        "expected_effective_attack_speed": 0.896875,
        "expected_attack_interval_ticks": 14,
        "expected_magic_bolt_cooldown_ticks": 28
      },
      {
        "name": "positive_speed_item",
        "dex_attack_speed": 1.28125,
        "weapon_attack_speed": 1,
        "item_attack_speed_percent": 10,
        "expected_effective_attack_speed": 1.409375,
        "expected_attack_interval_ticks": 9,
        "expected_magic_bolt_cooldown_ticks": 18
      },
      {
        "name": "negative_speed_item",
        "dex_attack_speed": 1.28125,
        "weapon_attack_speed": 1,
        "item_attack_speed_percent": -20,
        "expected_effective_attack_speed": 1.025,
        "expected_attack_interval_ticks": 12,
        "expected_magic_bolt_cooldown_ticks": 24
      }
    ]
  },
  "skill": {
    "skill_id": "magic_bolt",
    "class": "sorcerer",
    "tree": {
      "tier": 1,
      "column": 1
    },
    "kind": "projectile_attack",
    "max_rank": 10,
    "requirements": {
      "level": 1,
      "level_per_rank": 1,
      "stats": {
        "magic": 5
      },
      "stats_per_rank": {
        "magic": 3
      },
      "skills": []
    },
    "rank_requirement_cases": [
      {
        "rank": 1,
        "level": 1,
        "stats": {
          "magic": 5
        }
      },
      {
        "rank": 2,
        "level": 2,
        "stats": {
          "magic": 8
        }
      },
      {
        "rank": 5,
        "level": 5,
        "stats": {
          "magic": 17
        }
      }
    ],
    "rank_cases": [
      {
        "rank": 1,
        "mana_cost": 1,
        "damage": {
          "min_percent": 300,
          "max_percent": 225
        }
      },
      {
        "rank": 2,
        "mana_cost": 1,
        "damage": {
          "min_percent": 374,
          "max_percent": 268
        }
      },
      {
        "rank": 5,
        "mana_cost": 1,
        "damage": {
          "min_percent": 608,
          "max_percent": 406
        }
      }
    ]
  }
}
